_id,source,shared_from,date,text,reactions,likes,ahah,love,wow,sigh,grrr,comments,post_id,url
ObjectId("5e0ca44f4c36d57ff9611d71"),Zambian Watchdog,,2017-12-15 07:20:56,ANOTHER CBU STUDENT DIES FROM POLICE BEATING, PICKED BY AMBULANCE FROM CBU CLINIC Ambulance picks another dead body from the  Copperbelt University clinic. As you can see the body is fully covered to the head proving that this is not a patient but a dead body. The use of an ambulance is clearly part of the coverup as a police van will agitate students. And students are heard shouting 'another victim sure! The evidence is there, a lot of it. These people are cheating us, there, they have picked another one.' Last week the police raided Copperbelt University at night and beat up students savagely following a raw over meal allowances. The PF regime stopped given students meal allowances and banned students union. It is reported that at least three students were killed in the attack but the government is covering up the deaths.  The student being picked in the video has been named only as Rodness,262,147,2,2,1,69,41,111,1731844796866263,/story.php?story_fbid=1731844796866263&id=129987587052000
ObjectId("5e0ca44f4c36d57ff9611d72"),Zambian Watchdog,,2017-12-16 10:08:20,Prayer for PF police,915,656,249,7,2,,1,187,1733153816735361,/story.php?story_fbid=1733153816735361&id=129987587052000
ObjectId("5e0ca44f4c36d57ff9611d73"),Zambian Watchdog,,2018-04-12 13:55:51,Kawambwa Mbereshi road.,141,113,1,2,9,14,2,65,1861340847249990,/story.php?story_fbid=1861340847249990&id=129987587052000
ObjectId("5e0ca44f4c36d57ff9611d74"),Zambian Watchdog,,2018-04-12 13:17:10,Chishimba Kambwili says the K36, 000 President Edgar Lungu stole from a widow when he was practicing as a lawyer might sound little today but at the time he stole it, it was enough to build a house.  And Kambwili has maintained that Lungu is a drunkard. He was speaking  in Luapula where he is campaigning in a ward by-election.,434,402,23,4,1,2,2,147,1861306713920070,/story.php?story_fbid=1861306713920070&id=129987587052000
ObjectId("5e0ca44f4c36d57ff9611d75"),Zambian Watchdog,,2018-04-19 08:27:27,,405,336,42,15,2,8,2,116,1868593999858008,/story.php?story_fbid=1868593999858008&id=129987587052000
ObjectId("5e0ca44f4c36d57ff9611d76"),Zambian Watchdog,,2017-12-10 19:21:33,,188,176,1,8,3,,,23,1727269253990484,/story.php?story_fbid=1727269253990484&id=129987587052000
ObjectId("5e0ca44f4c36d57ff9611d77"),Zambian Watchdog,,2017-11-27 16:18:42,Watch how Zimbabweans booed and jeered Edgar Lungu when he went for inauguration of the new president,298,219,63,3,11,2,,132,1712458418804901,/story.php?story_fbid=1712458418804901&id=129987587052000
ObjectId("5e0ca44f4c36d57ff9611d78"),Zambian Watchdog,,2017-12-06 08:11:19,,493,427,3,28,6,27,2,89,1722715207779222,/story.php?story_fbid=1722715207779222&id=129987587052000
ObjectId("5e0ca44f4c36d57ff9611d79"),Zambian Watchdog,,2017-11-10 11:50:50,After been condemned left, right and centre on his intentions to try a third term, Edgar Lungu says he will leave in 2021. ‘By the way I am only going upto 202,” Lungu blurted  at a Zambia Association of Manufacturers event. During the ceremony to officiate at the "Meet the President Dialogue" at Radisson Blue, he stated that he is only going to be in office as provided for in the Constitution until 2021, when his term of office ends. He urged Manufacturers to always engage Government as the economic knows no politics. Lungu said whoever would be Head of State has to also engage manufacturers for the industrialization program to work.,347,308,29,7,2,1,,193,1694409210609822,/story.php?story_fbid=1694409210609822&id=129987587052000
ObjectId("5e0ca44f4c36d57ff9611d7a"),Zambian Watchdog,,2017-10-17 20:23:28,One Lungu,Kelly Musebo and 1.3K others,984,298,35,4,2,,221,1671527216231355,/story.php?story_fbid=1671527216231355&id=129987587052000
ObjectId("5e0ca44f4c36d57ff9611d7b"),Zambian Watchdog,,2017-10-31 20:03:24,Edgar Lungu is in Luapula pretending to show compassion to people displaced from Congo. But in Zambia his partners are busy displacing poor villagers from their ancestral lands,94,84,,2,2,6,,11,1685170198200390,/story.php?story_fbid=1685170198200390&id=129987587052000
ObjectId("5e0ca44f4c36d57ff9611d7c"),Zambian Watchdog,,2017-10-29 10:52:56,Just after saying ‘amen’ at the so called day of national prayers. PF thugs attempting to lynch Chishimba Kambwili as they verbally abuse him at Sata’s memorial,380,284,29,,7,53,7,185,1682791875104889,/story.php?story_fbid=1682791875104889&id=129987587052000
ObjectId("5e0ca44f4c36d57ff9611d7d"),Zambian Watchdog,,2017-10-17 07:58:36,Compare the length and cost of  this network of bridges and multi carriage ways to Edgar Lungu’s Ndola - Lusaka joke and plunder,246,207,3,11,22,3,,75,1671012129616197,/story.php?story_fbid=1671012129616197&id=129987587052000
ObjectId("5e0ca44f4c36d57ff9611d7e"),Zambian Watchdog,,2017-10-07 19:29:13,This man is convinced that Edward Lungu is a thief,601,376,199,16,8,1,1,201,1662127077171369,/story.php?story_fbid=1662127077171369&id=129987587052000
ObjectId("5e0ca44f4c36d57ff9611d7f"),Zambian Watchdog,,2017-10-06 15:04:15,Meanwhile, Kambwili says he has reported the matter to police,799,616,161,14,7,1,,304,1661005050616905,/story.php?story_fbid=1661005050616905&id=129987587052000
ObjectId("5e0ca44f4c36d57ff9611d80"),Zambian Watchdog,,2017-10-15 16:51:05,ONE MILLION DOLLARS FIRE TENDERS LOOK LIKE WHEELBURROWS, SAYS MINISTER MULUSA Lucky Mulusa mocks government investment in Fire Tenders* *"And the government communication on the same is senseless"* Minister of National Planning Development and nominated MP has mocked the purchase of Fire Tenders by his own government. Lucky Mulusa says Zambia's acquired fire tenders are only comparable to wheel burrows!😳 Speaking at a CIMA Budget function Mulusa says government was paralyzed by poor communication which was a matter of concern! He criticized the poor communication from government on the matter calling it senseless! Government recently purchased 42 fire trucks at a cost of $42million a matter that has raised a heated debate.,375,292,67,4,3,8,1,124,1669524296431647,/story.php?story_fbid=1669524296431647&id=129987587052000
ObjectId("5e0ca44f4c36d57ff9611d81"),Zambian Watchdog,,2017-10-06 08:24:19,Here is the witness explaining how the PF and Rupiah Banda stole and concealed more than 12 000 votes for Hakainde Hichilema in Kalulushi constituency alone.   This is just a tip of the iceberg on the terrorism and coup that happened in 2016. HH won those elections without a doubt. This is why they couldn’t allow the petition to be heard. Such evidence was going to come out. Edgar Lungu is not the legitimate president of Zambia. He is in office by fraud. He can do whatever he is doing for now, but time of reckoning will come.  These are the issues Zambians should be protesting and fighting about. This man’s life is clearly in danger. We are aware that there are so many people with such evidence and confessions but might not be as courageous as this one. But in time , they will come out.,295,255,18,2,13,5,2,145,1660759200641490,/story.php?story_fbid=1660759200641490&id=129987587052000
ObjectId("5e0ca44f4c36d57ff9611d82"),Zambian Watchdog,,2017-10-06 14:38:19,Caught on camera: Jean Kapata boasting how she assaulted  Chishimba Kambwili while other ministers laugh in merriment.,723,477,140,5,21,72,8,351,1660985420618868,/story.php?story_fbid=1660985420618868&id=129987587052000
ObjectId("5e0ca44f4c36d57ff9611d83"),Zambian Watchdog,,2017-09-18 08:04:47,CHINESE NATIONALS CLOBBER ZAMBIAN OVER GIRLFRIEND A Zambian national studying in China and only identified as Chabala is battling for his life in a Beijing hospital after he was brutally beaten by that country's nationals with metal bars after he was accused of having a sexual affair with a Chinese girlfriend to one of the assailants.  Chabala was cornered in a night club on Saturday night after staying with the same girl since Thursday, according to his friends who are living in fear of their lives.  The information has since been communicated to the Zambian embassy in China. Meanwhile, back home and in other African countries Chinese men are busy ripping girls off and the economy in collusion with corrupt leaders.,987,418,13,1,15,239,301,930,1644523155598428,/story.php?story_fbid=1644523155598428&id=129987587052000
ObjectId("5e0ca44f4c36d57ff9611d84"),Zambian Watchdog,,2017-09-17 23:10:56,KASAMA SERVICE STATION BURNT DOWN, NO FIRE TENDER IN SIGHT Total service  filling in Kasama has been burnt down. Using hosepipes, Workers at the service station struggled from around 19 hours local time to put out the fire to no avail.  Watch the video below. There was no fire tender in sight. The PF regime a few weeks ago  procured 42 fire tenders at the inflated prices of more than one million each. Surprisingly, in Kasama, one of the ten provincial headquarters there is no fire tender. So where are the fire tenders? This would have been a perfect opportunity to test these expensive trucks to see if they actually work.  Maybe they are still waiting for Jonathan Lungu to commission them but he is still too busy hiding the money in the Bahamas?,192,147,2,,5,37,1,83,1644235998960477,/story.php?story_fbid=1644235998960477&id=129987587052000
ObjectId("5e0ca44f4c36d57ff9611d85"),Zambian Watchdog,,2017-09-17 14:15:37,PF cadres beat traffic police officers In this video which has gone viral on Social media, a PF cadre with close contact with Edgar Lungu, Munir Zulu was captured beating up traffic police officers from Emmasdale police station. Police spokesperson Esther Mwaata Katongo confirmed the identity of the officers and their assailants in the event which happened on Friday and the victim officer was briefly detained for 'professional misconduct' while the cadre went Scot free. Zulu, who bought Edgar Lungu's hat at K185,000 at a PF fundraising dinner is a renowned drug dealer and criminal  motor vehicles. On this day he was driving a South African registered ML Mercedes Benz and speaking on his mobile phone thereby attracting officers who were on patrol. After his drivers license was confiscated by the cops, Zulu and his thugs descended on the poor cops. Earlier this year Katongo defended a drunk police officer who attempted to shoot UPND Mazabuka MP Garry Nkombo and his wife. Police later summoned Nkombo and charged him for interfering police from performing duties.,437,368,50,6,4,8,1,274,1643841052333305,/story.php?story_fbid=1643841052333305&id=129987587052000
ObjectId("5e0ca44f4c36d57ff9611d86"),Zambian Watchdog,,2017-09-17 09:23:52,Inflating figures on government projects such as the Lusaka-Ndola road, see how politicians were arrested in Brazil after leaving power. Lungu beware. Time is coming,133,125,2,4,1,1,,20,1643670262350384,/story.php?story_fbid=1643670262350384&id=129987587052000
ObjectId("5e0ca44f4c36d57ff9611d87"),Zambian Watchdog,,2017-09-05 14:00:14,Happening in Kabwe:  PF cadres organised by Central province minister Sydney Mushanga and Permanent Secretary Chanda Kabwe take to the streets demanding the removal of Felix Mutati and other MMD aligned ministers. Mushanga provided the light truck while Kabwe provided logistics abusing government coffers.,232,195,25,1,7,3,1,123,1631595050224572,/story.php?story_fbid=1631595050224572&id=129987587052000
ObjectId("5e0ca44f4c36d57ff9611d88"),Zambian Watchdog,,2017-08-17 17:31:16,These Chinese infesters were arrested for  producing fake Heineken beer and without a trading or manufacturing licence in Matero. But lo and behold, the police released them after receiving bribes,491,276,89,4,25,15,82,545,1614700181914059,/story.php?story_fbid=1614700181914059&id=129987587052000
ObjectId("5e0ca44f4c36d57ff9611d89"),Zambian Watchdog,,2017-08-19 18:08:30,BREAKING NEWS : PF CADRES SURVIVE MOB ATTACKS FROM CONGOLESE AND ZIMBABWEANS AT SADC SUMMIT Patriotic Front cadres who went to the SADC Summit picketing had to be secluded for their own safety as Congolese and Zimbabweans charged to beat them up for supporting a dictator.  Protesters from various countries were given permits to picket the Heads of States summit to present their grievances , but it appears , there was an Alliance among citizens from countries where there is emerging intolerance and decay in Democratic values and respect to Human Rights , Swaziland,  Congo , Zimbabwean protesters came together demanding for SADC's actions on emerging dictatorship in their respective Countries that included Zambia.  But as this picketing continued , Zambia's ruling Patriotic Front cadres emerged with placards looking drunk singing meaningless songs like "Lolo Lolo Lolo Lolo Lolo " in what they said, a solidarity match for Edger Lungu's good governance with posters and placards praising Mr Lungu who is now widely seen and viewed as a dictator. This infuriated other protesters who descended on the Zambian cadres with all manner of objects forcing these cadres to scamper and flee for safety.  " The situation got bad for PF cadres here , at some point, South African Police had to intervene when a fight broke up between the PF and the other groups. For the first time, we saw PF being humble " said the source https://www.zambiawatchdog.com/pf-cadres-survive-lynching-in-sa/,278,220,46,2,8,2,,88,1616579998392744,/story.php?story_fbid=1616579998392744&id=129987587052000
ObjectId("5e0ca44f4c36d57ff9611d8a"),Zambian Watchdog,,2017-08-12 23:48:54,POLICE OFFICERS FIGHT OVER BRIBE SHARING After failing to reach agreement on the sharing of the bribes from motorists, these police officers resolved to arrive at the answer to the equation by fighting in full view of people who had been booked for traffic offenses.,559,408,116,5,10,15,5,259,1610263055691105,/story.php?story_fbid=1610263055691105&id=129987587052000
ObjectId("5e0ca44f4c36d57ff9611d8b"),Zambian Watchdog,,2017-08-14 22:20:58,Real PF officials in Eastern province reject MMD officials such as Mwanawasa who have hijacked the party,102,97,5,,,,,25,1612120375505373,/story.php?story_fbid=1612120375505373&id=129987587052000
ObjectId("5e0ca44f4c36d57ff9611d8c"),Zambian Watchdog,,2017-08-05 11:37:24,Watch video as Turkey's main TV highlights crackdown in Zambia,456,410,6,10,5,22,3,64,1603015716415839,/story.php?story_fbid=1603015716415839&id=129987587052000
ObjectId("5e0ca44f4c36d57ff9611d8d"),Zambian Watchdog,,2017-08-05 08:51:13,News on South African Broadcasting last night and this morning on President Jacob Zuma's visit to Zambia and expected meeting with dictator Lungu over political crisis,226,214,4,6,,2,,28,1602897813094296,/story.php?story_fbid=1602897813094296&id=129987587052000
ObjectId("5e0ca44f4c36d57ff9611d8e"),Zambian Watchdog,,2017-07-30 11:14:43,Malema speaking about dictatorship in Zambia and the illegal state of emergence,650,575,33,37,4,,1,145,1597021243681953,/story.php?story_fbid=1597021243681953&id=129987587052000
ObjectId("5e0ca44f4c36d57ff9611d8f"),Zambian Watchdog,,2017-07-25 13:56:29,BY FORCE, PF CADRES EJECT TRADERS FROM THEIR STANDS In Lusaka, PF cadres have gone on rampage removing non PF supporters and the PF supporters viewed as sympathisers to Chishimba Kambwili from their stands in trading places. This video was taken under very serious and life threatening circumstances along Chachacha road outside the Anti Corruption Commission - ACC offices while police officers looked hopelessly.,77,71,2,,,1,3,17,1592118924172185,/story.php?story_fbid=1592118924172185&id=129987587052000
ObjectId("5e0ca44f4c36d57ff9611d90"),Zambian Watchdog,,2017-07-11 15:13:37,I AM THE PRESIDENT OF ZAMBIA, MWAMBA LIES TO PROTESTING SOUTH AFRICANS  South Africans this morning booed PF ambassador to South Africa Emmanuel Mwamba when he claimed that he is the president of Zambia. South Africans were protesting the dictatorship in Zambia.,231,187,31,4,2,7,,69,1576997139017697,/story.php?story_fbid=1576997139017697&id=129987587052000
ObjectId("5e0ca44f4c36d57ff9611d91"),Zambian Watchdog,,2017-07-11 18:10:13,,93,88,,3,,2,,16,1577161579001253,/story.php?story_fbid=1577161579001253&id=129987587052000
ObjectId("5e0ca44f4c36d57ff9611d92"),Zambian Watchdog,,2017-07-12 15:23:07,In this video, Central province minister Sydney Mushanga wonders why his PF cadres whose names he has submitted for employment cannot be employed as Teaching Service Commission members look astonished. The humble response to Mushanga's foolishness is this: The jobs that you have been advertising as having created are not there and there is no money to accomodate all those people claimed to be employed because the little money in the treasury is used to facilitate Edgar Lungu's travels and financing thugs in PF.  Most of the teachers who were recruited are not on the payroll, just like the many agro dealers under the notorious e-voucher system and repeatedly we have exposed these lies through this publication. In any case, Mushanga has exonerated us when we say that there are no jobs under the PF contrary to the thousands and thousands of imaginary jobs created by Lungu.,92,81,1,2,5,2,1,27,1578050072245737,/story.php?story_fbid=1578050072245737&id=129987587052000
ObjectId("5e0ca44f4c36d57ff9611d93"),Zambian Watchdog,,2017-07-11 00:04:15,Hmmmm,304,258,,22,4,18,2,65,1576378915746186,/story.php?story_fbid=1576378915746186&id=129987587052000
ObjectId("5e0ca44f4c36d57ff9611d94"),Zambian Watchdog,,2017-07-04 08:01:30,Watch city market burn... The British government recently warned that terrorist attacks in Zambia are likely. But Edgar Lungu said the so called tension in the country only exists in the minds of the three Church Mother Bodies as Zambia was at peace. This is not the Zambia we know.,488,380,5,,7,80,16,196,1569242486459829,/story.php?story_fbid=1569242486459829&id=129987587052000
ObjectId("5e0ca44f4c36d57ff9611d95"),Zambian Watchdog,,2017-07-04 20:37:56,In case you missed this tribal war: Ngonis attacked Chewas but in shame, the government media will never show you this,376,319,7,2,3,29,16,70,1569827776401300,/story.php?story_fbid=1569827776401300&id=129987587052000
ObjectId("5e0ca44f4c36d57ff9611d96"),Zambian Watchdog,,2017-07-08 09:39:27,CLIP FROM UPP LEADER DR. SAVIOUR CHISHIMBA'S PRESS CONFERENCE Due to demand from our readers, we hereby post a video clip from UPP president Dr. Saviour Chishimba's press conference which he held yesterday. In this clip Dr. Chishimba frankly tells off dictator Edgar Lungu to release UPND leader Hakainde, he tells him that he's a dull lawyer and needs mental examination.,558,488,45,19,4,,2,193,1573651309352280,/story.php?story_fbid=1573651309352280&id=129987587052000
ObjectId("5e0ca44f4c36d57ff9611d97"),Zambian Watchdog,,2017-06-25 19:14:34,Mob injustice Apparently Zambian women are in the forefront abusing other women.,Sibeso Lisulo and 3.2K others,2.4K,51,45,36,321,308,1586,1558521074198637,/story.php?story_fbid=1558521074198637&id=129987587052000
ObjectId("5e0ca44f4c36d57ff9611d98"),Zambian Watchdog,,2017-06-21 08:30:39,AFTER COURT TAKE BACK HH TO MUKOBEKO AND NOT CHIMBOKAILA AS ORDERED BY COURT - LUNGU Edgar Lungu has ordered ZAF Commander and Prison commissioner Percy Chato to immediately after the court hearing take back HH to MUKOBEKO. This means that the court order will be defied again but its not clear whether HH will even be taken to court today. Meanwhile, there are reports of Lungu sending a team to go and pick HH like a criminal from MUKOBEKO. Details later... https://www.zambiawatchdog.com/hh-to-be-taken-back-to-maximum-prison-after-court-hearing/,261,233,4,6,1,14,2,69,1553556978028380,/story.php?story_fbid=1553556978028380&id=129987587052000
ObjectId("5e0ca44f4c36d57ff9611d99"),Zambian Watchdog,,2017-06-17 11:32:32,There is no crisis in Zambia because I am able to fly around. The crisis exists only in the minds of the church mother bodies and NGOs,233,177,9,9,5,15,18,119,1549245145126230,/story.php?story_fbid=1549245145126230&id=129987587052000
ObjectId("5e0ca44f4c36d57ff9611d9a"),Zambian Watchdog,,2017-06-23 12:21:21,POLICE VIEWED AS THE MOST UNHELPFUL LAW ENFORCEMENT AGENCY-PARLEY COMMITTEE  The Parliamentary Committee on National Security and Foreign Affairs has told parliament today that the Zambia police is viewed as the most unhelpful law enforcement agency in Zambia.  The report further states that the police is ranked first in corruption among all law enforcement agencies while the Drug Enforcement Commission (DEC) is ranked first in confidence levels.  The Committee also states that it was very disappointed with the conduct of the police towards the committee in the course of its work including the police high command adding that it was confirmation of the public view that the police are the most inept law enforcement agency.  The house was told that the country only has two Juvenile Reformatory Schools resulting in Juveniles being put in the same cells with adults.,266,249,2,,1,6,8,89,1555841374466607,/ZambianWatchdog/photos/a.574571859260235/1555841374466607
ObjectId("5e0ca44f4c36d57ff9611d9b"),Zambian Watchdog,,2017-06-12 13:26:56,SOLDIERS IRRITATED BY HUGE PRESENCE OF POLICE IN KABWE  Soldiers in Baracks based in Kabwe are getting agitated by the presence of too many armed policemen in the normally quite town. Almost half the Zambia police has been moved to Kabwe because of UPND leader Hakainde Hichilema who is detained at Mukobeko maximum prison.  This morning, motorist staged protests against the presence of unprecedented levels of armed police men some carrying military weapons. Most shops and bus stations have been closed.  A senior military personnel told the Watchdog that there is agitation in baracks as Kabwe now resembles a war zone.  'The situation is quite provocative with all these women (police) milling around with weapons,' the soldier said.,490,453,14,4,2,11,6,217,1543644095686335,/ZambianWatchdog/photos/a.574571859260235/1543644095686335
ObjectId("5e0ca44f4c36d57ff9611d9c"),Zambian Watchdog,,2017-06-13 23:43:36,NAMIBIANS GIVE ZAMBIAN REGIME ULTIMATUM TO RELEASE TRUCKS Editor, I work at the High Commission in Namibia. I tell  you  the tension between Zambia and Namibia is growing everyday. Truck owners and drivers in Namibia have given Zambia up to Sunday to release the trucks and drivers the PF regime is detaining. The Namibians said if the trucks and drivers are not released, they will also start impounding Zambian trucks and detaining drivers. The Namibians are also mobilising themselves to go and demonstrate at the Zambian High  Commission in Windhoek. Zambia has so far wrecked its relationships with most countries from the time Edgar Lungu rigged the elections in 2016. Watch the news on Namibia's main television station NBC,96,94,,,,2,,47,1545350632182348,/story.php?story_fbid=1545350632182348&id=129987587052000
ObjectId("5e0ca44f4c36d57ff9611d9d"),Zambian Watchdog,,2017-06-10 18:50:20,UPND President Hakainde Hichilema's wife Mutinta walks away from Mukobeko maximum prison after police officers refused her entry and delivery food to her husband earlier today. Chiefs Mukuni and Hamusonde and UPND Vice President Geoffrey Bwalya Mwamba were equally blocked from visiting the UPND President.,196,127,1,1,1,47,19,68,1541839152533496,/story.php?story_fbid=1541839152533496&id=129987587052000
ObjectId("5e0ca44f4c36d57ff9611d9e"),Zambian Watchdog,,2017-06-09 11:53:16,WATCH POLICE PREPARING TO TAKE HH TO MUKOBEKO  As earlier reported, dictator Lungu using code name operation finish "OF" has since flown HH to Mukobeko. As Zambian Watchdog is reporting it is not clear whether HH will land safe as the plan is to clash land the chopper and kill him. Watch what happened when the Police under instructions from Kanganja picked HH from Chimbokaila  prison earlier on.,256,203,,2,1,30,20,123,1540505362666875,/story.php?story_fbid=1540505362666875&id=129987587052000
ObjectId("5e0ca44f4c36d57ff9611d9f"),Zambian Watchdog,,2017-06-08 17:00:50,EASTERN PROVINCE CHIEFS REFUSE TO BAN UPND Chief Nzanane tells Sakala to be careful  Eastern Province Chiefs have breathed fire following careless outbursts by Zambia Direct Democracy Leader, Edwin Sakala that UPND is a party for Tongas and Chiefs in Eastern province must ban it including Tongas from living there. Eastern Chiefs, through senior chief Nzamane describes the whole plan to ban UPND and Tongas in that province as stupid adding that Edwin Sakala he, himself is a tribalist. The Chief says UPND has people from Northern and Eastern provinces and wondered how the ZDDM leader would begin advocating for its banning including Tongas in Eastern province. He says no Chief will allow such a move as Zambia is a unitary state. Audio there👆 The senior Chief also says Sakala should take his stupidity to his chiefdom of origin adding that even there Chief Misholo will not allow such nonsense of fighting Tongas and banning UPND. Senior chief Nzamane also says Sakala must go back to school and learn political science because at the moment just like Lungu and Daily Nation Newspaper owner Richard Sakala he has lost brains. Edgar Lungu using Richard Sakala who is owner of Daily Nation Newspaper and his brother Edwin Sakala have launched a tribal and civil war against the Tonga people of southern province but resident in Eastern province. The trio have since started planning to also deregister UPND and kill anyone supporting it in Eastern province. Lungu wanted to use this idiot called Sakala to begin the tribal and civil war by telling Chiefs from Eastern province to chase all Tongas there but according to the audio we have received, the Chiefs through senior chief Nzamane have blasted Lungu, Richard Sakala and Edwin Sakala over their stupid tribal war. Listen in as attached straight and direct from kumawa.,184,177,1,5,1,,,104,1539650756085669,/story.php?story_fbid=1539650756085669&id=129987587052000
