_id,source,shared_from,date,text,reactions,likes,ahah,love,wow,sigh,grrr,comments,post_id,url
ObjectId("5e0ca44f4c36d57ff9611ba6"),Zambian Watchdog,,2020-01-01 10:51:04,Let’s start 2020 with Life style audit and Commission of Inquiry for plunderers of public resources By Eng Geoffrey Chishimba Chiyumbe As Zambians we  are being ushered into the year 2020 limping economically. According to the 2018 FIC report, a colossal  figure of USD 417 million was the amount the nation lost to corruption. This was caused partly by inflated contract prices and wasteful procurement and has been referred to in some circles as a self inflicted wound. Going into 2020 as a wounded nation entails that we need to carry out some emergency measures and this includes coming up with practical solutions to recover that gigantic amount. People working in the farm have unfortunately  eaten even the seeds leaving our mother Zambia limping. We must stop corruption, wastefulness and theft of public resources if we have to recover as a nation. It is time that we conduct a life style audit to recover stolen money to boost government coffers. We can't be this broke as a nation endowed with resources such as minerals.  We have just abused and plundered our state resources. We must carry out a life style audit and arrest the criminals. This can cover for instance a period of three years back, that is from 2016 to 2019. The categories often mentioned and proposed to be targeted are the following: 1) Politicians in power abusing state resources by awarding their businesses with  government contracts at  inflated prices. Carry out life style audit 2) ZRA being key in revenue collection for the government is cardinal in this exercise. Top management, senior managers and lower ranking employees are suspects in plundering state resources as they allegedly diverge into their pockets what belongs to the state coffers. Carry out life style audit. 3) Zesco load shedding has come because of Zesco's poor financial standing due to amongst others alleged abuse of authority, corruption and illegal legal tendering with inflated contract prices. Who have been benefitting from such contracts? Target top management and senior managers. Carry out life style audit 4) Senior civil servants have been mentioned in plundering public resources. Carry out life style audit To arrest the ever increasing rampant looting and plundering of public resources which has left government coffers bleeding, carry out life style audit on all senior leaders in government including quasi government institutions. This will Instill sanity in the system. Government money has been illegally transferred into people's pockets. In South Africa they are following such individuals legally of course and not witch hunting. THE Industrial Development Corporation (IDC) has dissolved the board of directors at Times Printpak and removed some senior management staff in a restructuring plan to revive the financially challenged company. Government must ensure Times of Zambia assets are not plundered during the restructuring exercise. When is the long overdue announcement of Zesco restructuring because if anything Zesco is technically insolvent and in intensive care unit and very critical to the survival of the Zambian economy than Times of Zambia.  With the announced tariff increases effective 1st January 2020 the fear and concern is that as long as the existing leakages identified by the restructuring task force are not sealed, the exercise could be futile in achieving improved profitability for the utility and just a further drain on the already heavily taxed Zambians. You can not fix a problem while maintaining the same people and systems that created it. Carry out life style audit and set up the commission of inquiry to pursue the plunderers. The move will not only recover some funds but most importantly will deter the future would - be plunderers. By this we will have arrested the growing trend of looting of public resources. The author is an Energy Consultant and Project Management Specialist, Chairman and Team Leader for 2017 Task Force on Energy Sector Reforms,62,58,1,3,,,,7,2919962151387849,/story.php?story_fbid=2919962151387849&id=129987587052000
ObjectId("5e0ca44f4c36d57ff9611ba7"),Zambian Watchdog,,2020-01-01 10:32:13,DRIUGS: CHIPIMO’ SON TO REMAIN IN JAIL   SON of former NAREP president Elias Chipimo is in detention at Kamwala Remand Prison in Lusaka on drug-related charges. Chito Chipimo appeared in court yesterday and pleaded not guilty to charges of drug trafficking, posessing psychotropic substances and unlawful use of motor vehicle. Chito of house number 2231 kasangula road Roma township denied the charges before Lusaka magistrate Albert Mwaba. Chito, is in the first count alleged to have trafficked 1.43 grams of cocaine on December 27, 2019 without lawful authority. It is also alleged that on the same date Chito had in possession 0.11 grams of amphetamine without lawful authority. Allegations in the third count, are that on December 27, 2019 Chito used a motor vehicle namely, Toyota blade registration number BAJ 9330 to carry, conceal and convey psychotropic substances without lawful authority. As he took plea, Chito kept his cast down avoiding eye contact with the presiding Magistrate as well as as the public in the gallary  His uncle, Francis Chipimo who is a deputy governer at Bank of Zambia attended the court hearing. According to sources, Chito has been involved in drug dealing and has been on the wanted list of the Drug Enforcement Commission (DEC). Chito was eventually cornered and apprehended at a shopping mall in lusaka  following a tip from an informer. After the hearing yesterday, Chito hid his face from the public as he jumped on DEC van truck headed to Kamwala remand correctional facility where he is detained. Trial commences on January 15, 2020 Kalemba,164,120,,2,7,35,,80,2919932154724182,/story.php?story_fbid=2919932154724182&id=129987587052000
ObjectId("5e0ca44f4c36d57ff9611ba8"),Zambian Watchdog,,2020-01-01 10:17:08,Chanda Nonde is the NGOs Registration board of Zambia chairperson.  See his hate, tribal speech 👇,88,44,3,,,29,12,113,2919909581393106,/story.php?story_fbid=2919909581393106&id=129987587052000
ObjectId("5e0ca44f4c36d57ff9611ba9"),Zambian Watchdog,,2020-01-01 10:12:05,*PF A BUNCH OF HARDCORE THIEVES AND GREEDY PEOPLE* By Maiko New Year Eve, 2019. *We voted for criminals, abamano baliya* You know PF will always especially now talk ill of HH for nothing but because they are scared of the cases after that and that they still want to steal, rip and rip. They will  give HH all tags. Look here in 2015 ECL declared his wealth at K2.5 Million. His salary when elected was about K37,000 per month. By Dec 2017 (about 16months) ECL was worth K23million. How possible that through allowances, salary he managed to make K20million in 16months? Then many of us Zambians would have been fairly rich or doing fine in life. Let him then teach us we do the same. Go to state Lodge and look at the houses these PF guys have in built between 2016 elections and now. The national House for Kaunda look like a Servants quarter of a visitors house. Go to Chamba Valley see how many plots and houses alleged to be for a named law maker. We may have roads in Lusaka and some being constructed but think of the nation at large. Main roads like Great East, North, Copperbelt, Southern maybe done. Go in districts you will realise PF has done nothing much. I will site districts: Go to Eastern province Districts and constituencies.  Chasefu has no roads, Vibwi, Chadiza, Kasenengwa, Chipangali, Malambo, Msanzala, etc have no. Go to Muchinga. Go to Luapula. Only Mansa has a road and the main road.  Check Kaputa etc you will cry. Go to southern province. There is no road in dundumwezi, no road in mapatizya, Kalomo,  kazungula to sesheke, mulobezi no roads. Go to Mongu. The same is the case with health facilities and education. For one known reason Lusaka look like Dubai that's where their businesses are and that's where they stay. We can't go on blaming God for economical challenges that's why we have leaders and President to offer policies and strategies in such times. As at now, it is as good as not having leadership so that we look up to God for favour. The problem is that PF is myopic. They don't think ahead of current situation but they manage to think ahead of their wealth. The hunger we have now is Artificial. When we had a bumper harvest in 2017, we decided to sale our maize outside. Remember the illegal case of export to Malawi which led to the firing of Malawian Agriculture Minister and arrest of Saviour Chishimba. In 2018 the government instructed farmers both small and large scale to sale maize wherever they wanted as there was no money for the purchase through FRA. Government gave FRA K650 to buy maize. Famers sold where there was competitive prices. If we had kept our maize this hunger and mealie meal prices wouldn't have affected us. Legally we have transported over 500 Mukula Containers (I don't know how many illegal) but what can we point at that this is what we have gained? Just few months ago we were struggling to find $40m to pay ESKOM, we have a bill with Maamba power plant. So where is mukula  money. If we had objective and fair leaders, Mukula money would have helped us pay Euro bond and other loans we have. But our personal pockets are more important. PF actually is not corrupt but they are hardcore thieves. Maiko,102,88,7,5,,1,1,36,2919899724727425,/story.php?story_fbid=2919899724727425&id=129987587052000
ObjectId("5e0ca44f4c36d57ff9611baa"),Zambian Watchdog,,2020-01-01 00:04:57,Happy corruption free new year to ZWD readers,647,513,83,45,6,,,83,2918838154833582,/story.php?story_fbid=2918838154833582&id=129987587052000
ObjectId("5e0ca44f4c36d57ff9611bab"),Zambian Watchdog,,2019-12-31 19:36:22,Digital migration thief  Malupenga replaces Kasolo  Tourism and Arts Permanent Secretary Amos Malupenga  has been transferred to the Ministry of Information and Broadcasting Services in same capacity.. This is the same ministry Malupenga looted millions of US Dollars but the crime has been swept under the carpet though police finalised investigations.  Gender PS Auxilia Ponga has been moved to Tourism.. On 14 July 2014, then North-Western Permanent Secretary Amos Malupenga broke down and cried like a baby when he was warned and cautioned over corruption in the digital migration case he was involved in while he served as Permanent Secretary at the Ministry of Information. Investigative officers Ferguson Kombe and Diana Phiri both from Anti-Corruption Commission Headquarters in Lusaka recorded the warn and caution statement from Malupenga at the Anti-Corruption Offices in Solwezi. At this point, Malupenga burst into heavy crying and asked to be given 15 minutes to catch a breathe outside and collect himself and was heard mumbling that his enemies are the ones behind his being investigated for corruption. With a warm and caution statement recorded, Mr. Malupenga should soon face arrest for the heavy corruption and kickbacks he received during the digital migration project he presided over as PS at Ministry of Information. The digital migration tender was to provide the supply, delivery and commissioning of the country’s National Digital Terrestrial Television Broadcasting System. The ZPPA was concerned about the way in which Amos Malupenga, the now former permanent secretary of the Ministry, gave the tender. There were serious irregularities in the way Malupenga handled the Digital Migration tender some of which included purchasing of second hand equipment. He disregarded dvise from the Zambia Public Procurement Authority (ZPPA) to give the contract to his partners.,118,95,14,,4,4,1,22,2918334578217273,/story.php?story_fbid=2918334578217273&id=129987587052000
ObjectId("5e0ca44f4c36d57ff9611bac"),Zambian Watchdog,,2019-12-31 19:00:12,Even without water, the Victoria Falls would still be a huge tourist attraction - HH,Owen Milasi and 1.8K others,1.6K,78,159,13,,,186,2918244654892932,/story.php?story_fbid=2918244654892932&id=129987587052000
ObjectId("5e0ca44f4c36d57ff9611bad"),Zambian Watchdog,,2019-12-31 18:40:31,The silent voice of people will send Lungu away from State House – Phiri COPPERBELT Advocacy for Justice and Peace executive director Abrahama Phiri says the Patriotic Front has fallen short of what it was formed under Michael Sata. Reflecting on the year 2019, Phiri said there should be no retreating on the fight against corruption. He said President Edgar Lungu should be more focused in 2020. “Without malice whatsoever, the President (Lungu) needs to now show leadership. It should not be business as usual. President Lungu seem not to be serious or care about the welfare of the people. We are in an economic crisis created by the PF and Mr Lungu. Mr Lungu should be more serious as President in 2020,” Phiri said. “No retreat, no surrender on fighting corruption. He needs to be more serious and dedicated to work. Corruption in his government is what has made us to be where we are today.” He said the majority Zambians were suffering in silence. Phiri, a human rights activist, noted that the silent voice of the people would send President Lungu away from State House. “If there is something dangerous is a silent person. The silence of the Zambian people will speak so loud come 2021, that we have seen and it will happen,” he said. Phiri said the crisis the country was in today could only be resolved if the President shows serious leadership. And Phiri said 2019 had been a year of misery. “We have seen a lot of bad sides in 2019. The unprecedented hike in mealie meal, load-shedding… This is what 2019 has provided for us. But all this falls on the President who is Edgar Lungu. If the President is not showing well, nothing can change for the citizens,” Phiri said. “In 2019 we also observed a lot of arrogance from those in authority. The political space reduced also. The PF cadres’ high levels of violence without regard to the law. Unfair dismissals. This is what the PF presented to us in 2019. We hope things can slightly change going in 2020. It is those in authority to make this become a reality.” He said poverty has been the order of the day for the citizens. “We have been doing little or nothing to improve the lives of the people of Zambia. When we speak like this we don’t mean to make the party in government unpopular but we want them to change the lives of the people,” said Phiri. The Mast,161,153,,6,1,1,,34,2918194631564601,/story.php?story_fbid=2918194631564601&id=129987587052000
ObjectId("5e0ca44f4c36d57ff9611bae"),Zambian Watchdog,,2019-12-31 18:12:19,Sheriffs Under Attack! By Dickson Jere Something is amiss with our police. And the top command seem not bothered with their inability to protect citizens. Just few weeks ago, an officer from the Sheriffs of Zambia office was badly attacked by suspected cadres when he tried to enforce a Court Order - the Inspector General of police is much aware of this incident. And he is quiet! You see, the Sheriffs of Zambia Office is part of the Judiciary and established under Chapter 37 of the Laws of Zambia to among other things “receive and execute” all Writs from our Courts. That is the enforcement arm of the judiciary, which works closely with Zambia Police. But now this important office is under systematic attack! And the police is not doing anything! Those who owe money or have invaded land hire gangs to chase the officers of the Sheriffs office when they go to enforce Court Orders. A very sad phenomenon! This may breed counter-gangs. People will opt to hire gangs to enforce Court Orders if the police continue to refuse to protect them. I have a case in which the Sheriffs of Zambia has informed me that they cannot enforce my Court Order without police - who are not willing to accompany them because of the suspected cadres involved. This is lawlessness which cannot be condoned! I know of a widow who just lost her 60 acres of land in Lusaka West because police refused to accompany the Under-Sheriffs to execute the Writ of Possession after suspected cadres invaded her farmland. Those with money are opting to use unorthodox means by hiring Zambia National Service (ZNS) on the pretext of going clear their farm but in fact use them to chase squatters! Why should ZNS be doing police work? Where is the Police? The IG Kanganja is a friend of mine. Very lovely gentleman and extremely accessible! But I think he is failing to show leadership! This is what I told him this morning in my note to him, which read but only in part as follows: “this is very dangerous path as our country can slide into lawlessness. Kindly be on top of this issue. I do not think H.E President Edgar Lungu can condone cadres threatening sheriffs of Zambia officers carrying out official duties...”. In short, I was saying my IG friend is failing the nation!,108,94,4,,2,6,2,35,2918121584905239,/story.php?story_fbid=2918121584905239&id=129987587052000
ObjectId("5e0ca44f4c36d57ff9611baf"),Zambian Watchdog,,2019-12-31 17:54:28,Just after the arrest of the dirty jerabo who was playing with a gun, Spax mining proprietor Spax Mulenga dares the police with live armo, semi automatic rifle,506,284,142,8,11,48,13,525,2918071071576957,/story.php?story_fbid=2918071071576957&id=129987587052000
ObjectId("5e0ca44f4c36d57ff9611bb0"),Zambian Watchdog,,2019-12-31 16:57:43,COFFINS FOR SALE AT GATE OF KAMUCHANGA HOSPITAL  By Chiza Chirwa  Kamuchanga hospital in mufulira needs serious hospital administrative tutorials. When you enter the hospital gates you are welcomed by coffins displayed for sale inside the hospital premises.before a patient seeks help from a doctor ,the coffins are seen first. This is putting up a very bad psychological warfare on the mind of a patient.even if a patient was to recover,just the sight corrupts his or her mind.this is a place where a patient is seeking help to get better. Do we have an administrator in place.where are counselling officers here. That coffin business is to be done not anywhere near the outpatient department or in the hospital premises. Can the powers that be do something.,322,169,92,3,3,48,7,190,2917934811590583,/story.php?story_fbid=2917934811590583&id=129987587052000
ObjectId("5e0ca44f4c36d57ff9611bb1"),Zambian Watchdog,,2019-12-31 16:44:35,,202,115,45,1,6,12,23,141,2917904088260322,/story.php?story_fbid=2917904088260322&id=129987587052000
ObjectId("5e0ca44f4c36d57ff9611bb2"),Zambian Watchdog,,2019-12-31 14:58:11,,91,69,10,1,5,5,1,45,2917659048284826,/story.php?story_fbid=2917659048284826&id=129987587052000
ObjectId("5e0ca44f4c36d57ff9611bb3"),Zambian Watchdog,,2019-12-31 14:05:49,Chingola Police have Apprehended the PF Thug who was seem Brandishing an AK47 dangerously  Maxwell Mofya known by his copper thief name ’Tablet’ was shown Brandishing an AK47 and firing shots.,451,308,85,6,8,35,10,407,2917556471628417,/story.php?story_fbid=2917556471628417&id=129987587052000
ObjectId("5e0ca44f4c36d57ff9611bb4"),Zambian Watchdog,,2019-12-31 12:51:22,President Edgar Chagwa Lungu being saluted by Inspector General of Police Kakoma Kanganja during the commissioning of State House Senior Officers Mess in Lusaka.,348,311,21,2,2,11,1,57,2917430114974386,/story.php?story_fbid=2917430114974386&id=129987587052000
ObjectId("5e0ca44f4c36d57ff9611bb5"),Zambian Watchdog,,2019-12-31 11:46:35,Hide my ID. The National road fund agency at shimabala toll plaza gas fired 9 toll collectors at once on fraud charges.  The 9 received their letters yesterday and have since been replaced by staff from other plazas and relatives to senior staff.  Besides toll collectors being fraudsters,  the Chinese YASN system is also serious faulty unlike the  initial Necor Zambian system that was being used.  NRFA has also consistently denied their staff to be unionized just for them to be fired like chickens and replaced by their own, as either related or wa chipani. Affected staff have also stressed that tolling was actually better in the hands of RDA. This  firing is actually meant to continue on other tolling stations. The question is . If mere  toll collectors go away with huge sums of money, what of the bosses? What is the purpose of the public paying when our money is going in people's pockets? We advise the agency to go cashless.  We demand for monthly financial reports for each toll plaza and that the money should be channed to working on that particular road stretch.  We demand accountability. Concerned citizen. CS.,98,82,3,,3,9,1,25,2917331954984202,/story.php?story_fbid=2917331954984202&id=129987587052000
ObjectId("5e0ca44f4c36d57ff9611bb6"),Zambian Watchdog,,2019-12-31 11:42:47,HEADMAN HABEEZU IN ANOTHER LAND SAGA Dear Zambian watchdog editor The headman of habeenzu village in chief shakumbila of shibuyunji district has been grabbing land from his subjects and selling it to big fishes from Lusaka . last year he grabbed land from different subject even reaching to an extent of beating an old woman who later took him to court but later aquited him after paying the old woman some good money . As at now 4 people including an old man has been arrested by corrupt shibuyunji police who always shield him  after protesting over the land he grabbed from them and sold it to big fishes from Lusaka. He is even evicting villagers from the village for no reason just because he wants to sell their land which they have been occupying since 1958.  For more information or verification contact Clifford 0764030218 , Dilux 0967418029 , Hilda 0976702366  Sydney 0978461313 or check at shibuyunji police where those arrested are since Sunday 28th  to intimidate them so that they lose their land for ever,55,41,1,1,3,9,,11,2917326028318128,/story.php?story_fbid=2917326028318128&id=129987587052000
ObjectId("5e0ca44f4c36d57ff9611bb7"),Zambian Watchdog,,2019-12-31 11:22:09,KALUSHA BWALYA TO RETURN TO FAZ CONTROL ROOM  Meet Gideon Mwenya. This is the person that sports minister Emmanuel Mulenga, Kalusha Bwalya, State House spokesperson Isaac Chipampe want to instal as FAZ President. Mwenya will be a puppet for Kalusha Bwalya. They had to to dig Mwenya from some rock so that they can use him as a front for Kalusha Bwalya to continue milking FAZ. Kalusha Bwalya himself will not stand for election given his dirty recent past.,196,160,27,4,4,1,,150,2917298331654231,/story.php?story_fbid=2917298331654231&id=129987587052000
ObjectId("5e0ca44f4c36d57ff9611bb8"),Zambian Watchdog,,2019-12-31 10:54:16,INFAMOUS QUOTES OF 2019 Last cries of sinking ship  2019. 1. Inonge Wina - We haven't bought a presidential jet, it is ZAF which has bought. It is mandated to buy a jet for VVIPs like the president. 2. Dora Siliya - We haven't sold Zaffico we are just selling its shares 3. Amos Chanda - No donor funds have been emmbezzled, the money is just sitting in Zanaco (whilst other poor people have not been paid.) 4. Margaret Mwanakatwe - All projects below 80% completion wont be funded, except for chinese financed projects (Which are the bulk of all projects) 5. David Mabumba - we have suspended the exams due to rampant leakages and will issue the same exams because we hope those with leaked papers will have forgotten the answers by then. 6. Given Lubinda - As PF we promised to revise the public order act, but we are waiting for opposition to make submissions. 7. Jean Kapata - the figure that China reported for mukula imported from Zambia is higher than what we recorded as exports because you have to believe me. I am telling you the correct figure. 8. Steven Kampyongo - the riots in Kitwe were caused by misinformation by HH but we are not going to interfere with investigations. 9. Dora Siliya - we haven't sold ZNBC we have just handed over the assets to Topstar which is controlled by China through Hantex. 10. Nkandu Luo - We have banned all students union who used to represent student interests and replaced them with the guild model, which will be made up of students who will represent student interests. 11. Ronald Chitotela - The tollgate is worth US$4.3 million because it has sophisticated equipment like computers, servers and a shelter. 12. Godfridah Sumaili - It is a national day of prayer but the Muslims can't come. There will be confusion if they come. 13. Vincent Mwale - The fire tenders are so sophisticated that they are worth US$1million but insured at US$250K 14. Edgar Lungu - Zambia is a christian nation and the church should pray for us, but I don't want them to lead the dialogue process. 15. Bishop Ed Chomba - This newly built flyover bridge on Alick Nkhata road lacks the basic minimum standards of a bridge, it's a death trap and therefore it must be demolished. 16. Charles Banda -  The statement made by Bishop Chomba was not a Ministerial statement or Government Position on the bridge, and that his Ministry has not found any reason why the Bridge should be demolished. 17. Dora Siliya - ZNBC is the most popular Television Station in Zambia. 18. Inonge Wina - Cannabis still Remains illegal in Zambia. 19. Inonge Wina - It's not all Zambian Mukula that China imports from Zambia.,536,333,155,1,1,41,5,177,2917259088324822,/story.php?story_fbid=2917259088324822&id=129987587052000
