_id,source,shared_from,date,text,reactions,likes,ahah,love,wow,sigh,grrr,comments,post_id,url
ObjectId("5e0ca44f4c36d57ff9611caa"),Zambian Watchdog,,2019-12-11 13:16:37,PF HOSTILE HIJACKING OF PRIVATE AND PUBLIC ENTITIES FOR PRIVATE GAIN TO CONTINUE. By: Anthony Bwalya - UPND Member Information has emerged that the Patriotic Front (PF) government plan to leverage political arrogance to hijack the Bulk Power Supply Agreement in respect of the Copperbelt Energy  Corporation (CEC) and throw it into the hands of vultures, most likely the Chinese, for the benefit of top government politicians.   With a combined infrastructure and asset value in excess of $500 million, corrupt PF politicians stand to pocket well over $50 million in bribes and kickbacks associated with any possible transfer of the energy monopoly from CEC to their preferred bidder. This is part of a long standing, calculated scheme by corrupt PF politicians to continue on their unrelenting and sworn path of peddling illegality for their own private benefit, and much at the expense of the wider economy.  This is why ZESCO has been dithering for close to a year to engage in constructive discussions with CEC for purposes of resolving the status of the BSA post March 2020 when it comes up for renewal. The truth is that this process is and has never been in the hands of ZESCO, but rather that it has been taken over by corrupt PF politicians wanting to illegally benefit from this multi million dollar agreement. This also begins to clarify the charge by the American Ambassador to Zambia Mr. Daniel Foote, who in his most recent statement, revealed that domestic politics have gotten in the way of constructive discourse involving a domestic energy reform plan drawn up with the assistance of energy experts from the United States of America. The truth is, all technical negotiations involving the energy sector are no longer handled by technocrats but by greedy PF politicians seeking a pay cheque from every single energy sector transaction.  This is the primary motivation of PF politicians to constructively disrupt the BSA in respect of CEC. But people must realise that the culture of illegally disrupting and taking over of both public and private entities under the PF, and handing them to their friends, those of whom are willing to pay them multi million dollar kickbacks to say thank you for the dirty work, is not new. They are at it (trying) at KCM, where a technical and business turnaround issue was turned into a highly charged political issue. So while corrupt PF politicians continue to syphon money out of KCM, jobs are being lost and household incomes placed in such needless peril. And once they are done with KCM, the economy would have lost hundreds of millions of dollars due to the reckless disruption of operations at KCM. The plan for the PF has always been to hand over as much mining control to the Chinese as possible. This is why the Chinese have taken up pole position in the possible takeover of KCM, and are presently leading the charge for the commencement of mining activities in the ecologically sensitive Lower Zambezi National Park. It is also now in the public domain, that corrupt PF politicians, including the presidency, facilitated the casual seizure of the Mukula business from local companies by illegally taking over legally harvested Mukula logs by legitimate permit holders, and illegally sold it to their Chinese friends. This resulted in the economy losing over $500 million in revenue due to underdeclaration of exports, as well as bribes. And it is these same people who are lining up ZAFFICO for a "constructive" take over using markets as a conduit. Today, while our local farmers are paying a premium for foreign fertilizers imported by friends of the PF, top government politicians are getting paid several millions of dollars for suffocating Nitrogen Chemicals of Zambia (NCZ); sacrificing several jobs and incomes for our local people.  These are criminals whose only intention is to benefit from the suffering of Zambians, and they couldn't care less. It is visible from the amount of money the Patriotic Front (PF) injects into buying votes and disrupting our sense of collective purpose. The PF are prepared to disrupt economic activity on the Copperbelt, jeopardizing jobs for our people; by politically interfering the BSA negotiations involving ZESCO and CEC, and instead senselessly allege that a listed entity is funding the activities of the UPND. Nothing short of political stupidity. And China, a country that has been a friend of the Zambian people for several decades, has now realised the duplicity of the PF government, and all signs are that China is now  almost ready to pull the plug on the PF and heighten it's financing due diligence; because the corruption of PF politicians is not only costing Zambians their economy, it is also costing China money.,110,98,,3,,9,,29,2872966926087372,/story.php?story_fbid=2872966926087372&id=129987587052000
ObjectId("5e0ca44f4c36d57ff9611cab"),Zambian Watchdog,,2019-12-11 12:51:37,GBM After hearing that UPND has won Ilambo by-election,823,346,460,12,2,2,1,189,2872928536091211,/story.php?story_fbid=2872928536091211&id=129987587052000
ObjectId("5e0ca44f4c36d57ff9611cac"),Zambian Watchdog,,2019-12-11 12:20:45,PANJII SAYS CORRUPTION IN ZAMBIA STARTS AND ENDS WITH LUNGU  By Patson Chilemba Edgar Lungu’s statement that no corrupt element will be allowed to roam freely is an insult to the intelligence of Zambians, ruling PF member Colonel Panji Kaunda has charged. Commenting on President Lungu’s statement during the Anti-corruption day themed ‘United Against Corruption’, where the President spoke out against graft in his written speech, Col Panji said if any one were to listen to President Lungu and did not know anything about Zambian, they would be clapping right now, praising the President as an ardent corruption fighter. However, Col Panji said the only unfortunate part was that there was a huge variance between what President Lungu read in his written speech against his actions over the matter, saying corruption actually started and ended with President Lungu. “It’s an insult to our intelligence. It’s a big joke. Unless there is seriousness from the President himself, from his heart, not reading that corruption is evil we won’t go anywhere,” he said. Col Panji said the fight against corruption must start with the first family itself, saying the President himself should explain the source of his wealth, while at the same time telling the Zambian people where his daughter, Tasila, was getting the money for all the projects she was currently undertaking, including fencing the over 3790 hectares Forest Number 70 in Sinda, Eastern Province. He said already there was a report from an American organisation revealing the wanton corruption in the Mukula illegal trade. “There are reports that the daughter is building shopping malls where there used to be police stations, what is he doing about it? She has spent a lot of money fencing Chimutengo Forest, these are things the President must table in his own house” Col Panji said. “Like us the children of Dr Kenneth Kaunda, you won’t hear of us being involved in illegalities or that we had fenced off forests or were building malls where there used to be police stations. Let him begin with his daughter, where is she getting the money from.” Col Panji said Article 52 of the Constitution of Zambia guided how ministers and members of parliament must behave, but under President Lungu, his ministers and permanent secretaries were involved and profiting massively from government projects. He said corruption was right in front of President Lungu, saying everyone in the PF, from the highest office to the lowest cadre were now scavenging for government projects. “Corruption starts with him and ends with him,” said Col Panji.,Owen Milasi and 1K others,955,72,50,4,5,1,219,2872882239429174,/story.php?story_fbid=2872882239429174&id=129987587052000
ObjectId("5e0ca44f4c36d57ff9611cad"),Zambian Watchdog,,2019-12-11 12:02:39,A powerful former ally of Gabon President Ali Bongo was fired from his post and arrested on suspicion of graft, the latest fallout in the investigation into the more than USD $100 million missing from a state-controlled oil company’s coffers.  Brice Laccruche Alihanga, 39, was arrested Tuesday along with former Energy Minister Tony Ondo Mba and former Oil Minister Noel Mboumb,217,173,21,11,6,6,,105,2872857449431653,/story.php?story_fbid=2872857449431653&id=129987587052000
ObjectId("5e0ca44f4c36d57ff9611cae"),Zambian Watchdog,,2019-12-11 06:10:40,Editor, This is how farmers are spending nights in Mumbwa district, waiting for the  government to give them farming inputs. Is it fair surely? They have been sleeping on the coldness for almost three weeks and to make matters worse, they don't know when they will be given farming inputs. It is really sad, Evans,454,219,5,2,12,204,12,127,2872376659479732,/story.php?story_fbid=2872376659479732&id=129987587052000
ObjectId("5e0ca44f4c36d57ff9611caf"),Zambian Watchdog,,2019-12-10 21:15:15,Abusing public office,Thomson Banda and 1K others,525,256,16,17,201,46,819,2871551282895603,/story.php?story_fbid=2871551282895603&id=129987587052000
ObjectId("5e0ca44f4c36d57ff9611cb0"),Zambian Watchdog,,2019-12-10 21:30:53,This woman in the Diaspora has finished Bowman Lusambo. Reminds him of how he used to steal coffins but digging up dead people at the cemetery.,1.4K,853,458,29,103,12,3,786,2871577282893003,/story.php?story_fbid=2871577282893003&id=129987587052000
ObjectId("5e0ca44f4c36d57ff9611cb1"),Zambian Watchdog,,2019-12-10 20:47:49,Bowman Lusambo touches wrong button. Zambians in Diaspora offended by his insults,Innocent Israel Mataa Jr. and 1.8K others,793,834,14,207,36,7,1689,2871495489567849,/story.php?story_fbid=2871495489567849&id=129987587052000
ObjectId("5e0ca44f4c36d57ff9611cb2"),Zambian Watchdog,,2019-12-10 20:19:31,A big hole in the Carousel Shopping Centre car park. Letter by Mthoniswa Banda Dear Editor, LUSAKA 10/12/2019 - This morning my car fell into a ditch in the car park of Carousel Shopping Centre. There is a 1m by 1 m square hole cut right in the middle of the car park which has no warning tapes or markings that show the presence of this hole. When two cars are parked on both sides of the hole it is difficult for one to know that the available car park space has a hole on it. Unfortunately for me my front left wheel of my car went into this ditch. When I approached centre management office who are Lamasat Investment, the owners and managers of the Carousel Shopping Centre, to inform them of what had happened to me at the car park I was met by a very rude and un concerned manager. He told me it was not his concern that my car had fallen into a ditch and even if it was damaged I needed to sort that on my own. He said that it was my responsibility to make sure that I checked where I parked, even within his Shopping Centre. He even said if a person was injured within Carousel Shopping Centre as a result of their negligence it was not their responsibility to take care of the situation as every person visiting Carousel buildings was old enough to take care of themselves. This is sad thinking for a company managing a public place like a mall where hundreds of clients, men, women and children frequent. My appeal to the Lusaka City Council and Government is to inspect some of these business premises that have no sense corporate responsibility on the Zambians they serve. Most of these business premises have little or no social amenities for their clients and general public frequenting them.  They also have no security to protect and secure their clients and their property. Government should also review the safety measures being placed on these premises and ensure that these un caring owners are forced to insure against damage to clients and property while on their premises. If the rude and unconcerned attitude of management of Lamasat Investment is anything to go by, one wonders how their employees are treated and whether they would even be concerned with a death of an employee or customer happening on their premises.,114,89,2,,4,11,8,61,2871442429573155,/story.php?story_fbid=2871442429573155&id=129987587052000
ObjectId("5e0ca44f4c36d57ff9611cb3"),Zambian Watchdog,,2019-12-10 19:35:19,National Breweries says it will not give employees any bonus this year because it has made a loss of K28.9 million due to loadshedding, depreciation of the Kwacha and expensive maize,729,486,81,2,21,132,7,362,2871360392914692,/story.php?story_fbid=2871360392914692&id=129987587052000
ObjectId("5e0ca44f4c36d57ff9611cb4"),Zambian Watchdog,,2019-12-10 19:31:04,COPPERBELT UNIVERSITY LECTURERS NOT PAID FOR NOVEMBER, THREATEN TO STOP WORKING  PRESS STATEMENT ON DELAYED NOVEMBER 2019 SALARIES.  The  Copperbelt University  Academics  Union (CBUAU) has  noted with  dismay,  the  failure by CBU  Management  and  Government  to  pay  Salaries  to  workers  at  CBU  for  the  month  of November  2019.  This  trend  of  delayed  salaries  at  the  Copperbelt  University  is  very disappointing  and  demoralising  to  the  workers.  The  Copperbelt University  Academics  Union (CBUAU) shall therefore, not entertain this scenario anymore. Why should we be reduced to beggars? According to the Employment Code Act 2019 section 66 subsection (2), the law is very clear on payment of employee wages and it states as follows “The wages of an employee shall be  paid  at  regular  intervals  not  being  later  than  the  5th day  following  the  date upon  which  they  fall”. In this case, workers should have been paid on  the  28th of November 2019. Therefore, Management has abrogated the law by not paying the workers  on time.  What  is  disheartening  is  that  most  students  have  since  paid their  2020  tuition  fees  but  we have  a  poor  management  that  is  misdirecting  these  finances to  the  construction  of “Toll Gates” at highly exorbitant and exaggerated costs  but  which do  not  add  any  value  to  the running of  the  institution. We  have  mentioned time  and  again, that  we  have  a  failed Vice Chancellor  and  management  at  the  Copperbelt  University  that  needs  to be  removed  for things to return to normal.  To  this  effect,  if  the  delayed November 2019 salaries are  not paid  by Today Tuesday, 10th December 2019. The scheduled classes that commenced on Monday 9th December will not be conducted as members will be busy sourcing money elsewhere to take care of their families. Our members will only resume normal activities once they are paid.  To this effect, all matters to do with Board of Studies meetings, Board of Examiners, Senate Examination  Committee and  classes  will  not  take  place until November 2019 salaries  are paid.  Just like any other parent, we have children to send to school and families to feed at our homes and this continued delay of salaries is unacceptable and immoral.  ISSUED BY DR.  MUSONDA  EMMANUEL  KABASO , [DEPUTY GENERAL  SECRETARY – CBUAU],131,100,9,1,3,15,3,42,2871353086248756,/story.php?story_fbid=2871353086248756&id=129987587052000
ObjectId("5e0ca44f4c36d57ff9611cb5"),Zambian Watchdog,,2019-12-10 19:28:36,Editor, Am a client with Indo Zambia bank Mansa branch,I got a loan of 5pin last year and i delayed to pay due to financial constraints, to my surprise the bank took me to court and engaged the  court bailiffs to get my goods,what has surprised is that a bank sure sending a manager to stand against a client over a 5pin that could have been recovered thru ddac or payroll.shame such a useless bank,238,145,81,,4,7,1,230,2871348559582542,/story.php?story_fbid=2871348559582542&id=129987587052000
ObjectId("5e0ca44f4c36d57ff9611cb6"),Zambian Watchdog,,2019-12-10 15:22:27,Home Affairs minister Steven Kapyongo says there is no reason whatever that foreign nationals are allowed to engage in bricklaying or driving trucks in Zambia. He was speaking in parliament today when quizzed by Mongu Central MP.,147,128,2,,2,11,4,56,2870885866295478,/story.php?story_fbid=2870885866295478&id=129987587052000
ObjectId("5e0ca44f4c36d57ff9611cb7"),Zambian Watchdog,,2019-12-10 08:52:31,There are numerous factors that are causing the Kwacha to fall, premised on poor economic management. These are:  1. Debt servicing  2. Low investor confidence  3. Reduced exports  4. Reduced productivity  5. Capital flight  But HH, how will you fix it? In simple terms, we will: 1. Reschedule and restructure our debt 2. Build investor confidence through our robust fiscal strategy  3. Curb corruption and illicit financial flows 4. Refine mining policy to incentivise increased output  5. Engender growth in agriculture and agricultural exports  6. Provide capital for Zambian owned, companies  7. Ensure joint ventures between foreign investors and Zambians as well as promote reinvestment to reduce capital flight  Mwi sakamana mwebantu. Tuleisa muku kontolola ka economy. HH,324,293,5,16,2,8,,53,2870259399691458,/story.php?story_fbid=2870259399691458&id=129987587052000
ObjectId("5e0ca44f4c36d57ff9611cb8"),Zambian Watchdog,,2019-12-10 08:10:47,WHERE THINGS WENT WRONG AT NDF We argued and debated convincingly that this clause should remain and when it was voting time, PF that had numbers voted for its removal and since it was voting by hands not a single PF supported its retention. The big question is why was there a pick and choose of what should retained and what should be removed? It is these things that have punched holes in Bill 10. Coming to this clause on pension, it is the most wicked action of any political movement. In Zambia pensioners stay 20 years waiting. Anyway God will deliver Zambia. CC #ConcernedZambianCitizen,229,170,1,2,5,41,10,58,2870195966364468,/story.php?story_fbid=2870195966364468&id=129987587052000
ObjectId("5e0ca44f4c36d57ff9611cb9"),Zambian Watchdog,,2019-12-10 07:57:45,POLICE ALLOW KEBBY MBEWE TO PROVOKE, INSULT PEOPLE OF SOUTHERN PROVINCE AND PROMOTE TRIBALISM  PRESS STATEMENT* *10th December 2019* *PF'S KEBBY MBEWE IS AN ATTENTION SEEKING HYPOCRITE* We have noted with profound astonishment an attempt by PF Member of Central Committee Kenny Mbewe who has embarked on what he calls a protest walk from Lusaka to Livingstone, against what he says is tribalism by the people of Southern Province. This kind of grandstanding and comedy can only be familiar to a party that is losing relevance and identity like the PF.  For the record and for our citizens that don't know, Mr. Mbewe is currently based in the Provincial Capital of Southern Province, Choma District, where he freely plies his trade and businesses with the local people there. That is what all our  people regardless of ethnicity in the Province are known for.  Mr Mbewe owns 'Leon  Lodges and Hotels' in Southern Province and does all his PF politics from Choma without any difficulties from the local communities there. In fact, one would have expected Mr. Mbewe to be Southern Province's ambassador of peace by preaching to the other hardcore known PF tribalists, as revealed by the Commission of inquiry on Voting patterns, and the yellow pages of PF tribalism, on how he manages to conduct his activities in that region peacefully and without problems.  It is also note worth noting that the police have sanctioned such as a highly divisive exhibitionist behaviour, when they cannot allow citizens who want to protest against high levels of corruption, increased electricity loadsheding, high mealie meal prices, depreciation of the Kwacha, and other economic challenges being faced by citizens. As UPND in Southern Province, we can only wish Mr. Mbewe a safe and enjoyable walk as we shall offer him Chibwantu, mabisi, and other food stuffs on the way through snakes and other wild animals. We can guarantee him more freedoms and economic opportunities to achieve in his attention seeking road show and assure him that by the time he will be approaching his half way mark which should be around 2022, a more responsible UPND government under Mr. Hakainde Hichilema will have been in power. Bon voyage! *Neto Halwabala* *UPND Southern Province Information and Publicity Secretary*,228,178,26,2,2,19,1,163,2870177069699691,/story.php?story_fbid=2870177069699691&id=129987587052000
ObjectId("5e0ca44f4c36d57ff9611cba"),Zambian Watchdog,,2019-12-10 07:15:16,In this video, PF Secretary General Davies Mwila reveals a secret NRC registration programme in the PF perceived strongholds. Says in Chief Mibenge alone PF has given out 45000 NRC and he goes on to say they can't use three provinces to wipe Southern province votes. ZWD comment: beware PF, those same NRC will be used against you. When the hand of God is against you, there is nothing you can do. Remember ilambo ward! Those people you take for granted and assume that will adhere to your tribal politics might just disappoint you.,340,253,37,1,8,35,6,148,2870116679705730,/story.php?story_fbid=2870116679705730&id=129987587052000
ObjectId("5e0ca44f4c36d57ff9611cbb"),Zambian Watchdog,,2019-12-10 07:08:33,LUPOSOSHI LOSS LEAVES PF RUNNING AROUND LIKE THE HEADLESS  CHICKENS THEY ARE. NOW SAYS LAZARUS BWALYA CHUNGU TO REMAIN AS PROVINCIAL CHAIRPERSON-DAVIES MWILA "When the President speaks that is the end of the matter - SG Davies Mwila" Luwingu, Monday 9th December, 2019 "When the President speaks on a party issue and gives a position that is the end of that matter. I first made a statement on the Ilambo loss and then the President made a statement. President Edgar Lungu being the head of the PF party has made a final position on the Ilambo loss. So Hon Chungu Bwalya remains the PF Northern Province Chairman. It is a closed chapter," PF Secretary General Davies Mwila said this when he met Lupososhi and Luwingu PF district, constituency and ward officials, MPs and councillors at Triple Blessings Lodge in Luwingu. We lost the Ilambo ward by election because of complacency among ward, constituency, district and provincial officials. We are used to winning so we thought it is business as usual. We also had a wrong campaign manager in the name of Lupososhi Council Chairman John Kwandangala who had never visited Ilambo ward ever since he was elected as Lupososhi Council Chairman. The people of Ilambo ward were bitter that he had neglected them since they voted for him. I have reliable and verified information that Lupososhi MP Hon Chungu Bwalya almost every weekend whenever parliament is in session. The other reason I have gathered is that the PF Lupososhi District Chairman and Constituency Chairman were barring people willing to help them campaign in Ilambo ward. Campaigning is teamwork. To carry out an effective and efficient campaign you need the help of everyone. Embrace everyone in campaigns and work as a team. The fact that you have served in the party for a very long time must not make you ineffective and inefficient. It must make you sharper because you have rich experience in the party. We cannot put all the blame on the Lupososhi MP or the Lupososhi Council Chairman because campaigning is a collective work. It is a collective responsibility. We must all ask ourselves what we could have done better. We must all get involved in campaigning for our party. Finally, my mission was to visit Chilubi district and encourage our members there were we lost our MP Hon Rosario Fundanga but I thought of passing here since you are on the way to Chilubi. I urge you to wake up and commit yourselves to party work and to stop thinking that holding a party position is an end in itself. Those positions you hold are for performing party work. Speaking earlier Lupososhi MP Hon Bwalya Chungu said," I am very sad, hurt and embarrassed for the Ilambo loss. I know there is no enough explanation I can give to explain the loss in Ilambo ward. We have disappointed the President, Secretary General, the Central Committee and all our PF supporters. They are all angry and sad. The President personally told me that he was very angry and disappointed with me. I, Chungu Bwalya MP for Lupososhi constituency and PF Northern Province Chairman I have taken full responsibility of the Ilambo ward loss. We are human beings. We are not perfect. We made mistakes. We have learnt from our mistakes and we are going to reorganize ourselves and re-strategize and soldier on. We can only beg for your forgiveness. The Secretary General was accompanied by PF Legal Chairman Hon Brian Mundubile, PF National Youth Chairman Hon Kelvin Mutale Sampa, PF Western Province Chairman Kafuka Kafuka and PF Deputy Media Director Antonio Mwanza. Chanda Nsofu PF Northern Province Youth Secretary,158,130,25,,1,1,1,45,2870107963039935,/story.php?story_fbid=2870107963039935&id=129987587052000
